{"schema_version":"1.0.0","conclusion":"no_material_findings","findings":[],"commands":[{"command":"pwd && sed -n '1,240p' /private/tmp/readme-labs-codex-home.0L1wy6/plugins/cache/readme-labs/0.2.0-rc.1/skills/readme-review/SKILL.md","outcome":"failed"},{"command":"rg --files -g 'SKILL.md' /private/tmp/readme-labs-codex-home.0L1wy6 2>/dev/null || true\nrg --files -g 'README*' -g '!node_modules' .\nfind . -maxdepth 2 -type f -print | sort","outcome":"succeeded"},{"command":"sed -n '1,260p' /private/tmp/readme-labs-codex-home.0L1wy6/plugins/cache/readme-labs/readme-labs/0.2.0-rc.1/skills/readme-review/SKILL.md\nnl -ba README.md\nprintf '\\n--- pyproject ---\\n'\nnl -ba pyproject.toml\nprintf '\\n--- tests ---\\n'\nnl -ba tests/test_pebble_count.py\nprintf '\\n--- repository status ---\\n'\ngit status --short\ngit log --oneline -5","outcome":"succeeded"},{"command":"sed -n '1,260p' /private/tmp/readme-labs-codex-home.0L1wy6/plugins/cache/readme-labs/readme-labs/0.2.0-rc.1/skills/readme-review/references/roles-and-anatomy.md\nsed -n '1,300p' /private/tmp/readme-labs-codex-home.0L1wy6/plugins/cache/readme-labs/readme-labs/0.2.0-rc.1/skills/readme-review/references/evidence-and-verification.md\nsed -n '1,320p' /private/tmp/readme-labs-codex-home.0L1wy6/plugins/cache/readme-labs/readme-labs/0.2.0-rc.1/skills/readme-review/references/review-criteria.md\nprintf '\\n--- source files ---\\n'\nrg --files -g '!*.pyc' -g '!node_modules' .\nprintf '\\n--- Python implementation ---\\n'\nnl -ba src/pebble_count/__init__.py\nprintf '\\n--- tracked repository files ---\\n'\ngit ls-files","outcome":"succeeded"},{"command":"python --version\npython -m pytest -q","outcome":"failed"},{"command":"git diff --check\nfind . -maxdepth 1 -type f -name 'LICENSE*' -o -name 'COPYING*' -o -name 'NOTICE*'\ngit diff -- README.md pyproject.toml src/pebble_count/__init__.py tests/test_pebble_count.py","outcome":"succeeded"}],"verification":["README claims match the package metadata, console-script entry point, implementation, and test fixture: UTF-8 input, whitespace-only lines treated as blank, and integer output.","The README serves as a combined repository-root and small CLI-package interface; its install, use, development, and license guidance is proportionate to the repository."],"limitations":["Package installation, CLI execution, and test execution were not independently verified because the recorded Python command failed.","No package-registry rendering was inspected."]}