{"schema_version":"1.0.0","conclusion":"material_findings","findings":[{"title":"No reader path to install and invoke the CLI","category":"first_successful_path","severity":"material","path":"README.md","line_start":6,"line_end":11,"problem":"The README provides only contributor setup and tests. It does not tell a prospective user how to install the package, run its `pebble-count` command on a file, or what result to expect.","evidence":["`pyproject.toml` declares a distributable project named `pebble-count` and a `pebble-count = \"pebble_count:main\"` console-script entry point (lines 5-15).","The implementation accepts one required file path and prints the count (src/pebble_count/__init__.py lines 12-16).","The current commit removed a prior README “Getting started” section containing installation, invocation, and expected-output guidance."],"impact":"Readers can understand the utility's definition but cannot reach its primary CLI capability without inspecting packaging metadata and source code; the visible commands instead imply that development setup is the only supported path.","correction":"Restore a short user-oriented install-and-run example before Development, including the required file argument and that the command prints the non-blank-line count."}],"commands":[{"command":"pwd && rg --files -g 'README*' -g '!node_modules' -g '!vendor' && git status --short && git log -1 --oneline","outcome":"succeeded"},{"command":"sed -n '1,240p' /private/tmp/readme-labs-codex-home.0L1wy6/plugins/cache/readme-labs/0.2.0-rc.1/skills/readme-review/SKILL.md","outcome":"failed"},{"command":"rg --files /private/tmp/readme-labs-codex-home.0L1wy6/plugins/cache/readme-labs | rg 'SKILL\\.md$|readme-review'","outcome":"succeeded"},{"command":"sed -n '1,260p' /private/tmp/readme-labs-codex-home.0L1wy6/plugins/cache/readme-labs/readme-labs/0.2.0-rc.1/skills/readme-review/SKILL.md && sed -n '1,320p' /private/tmp/readme-labs-codex-home.0L1wy6/plugins/cache/readme-labs/readme-labs/0.2.0-rc.1/skills/readme-review/references/review-criteria.md && sed -n '1,320p' /private/tmp/readme-labs-codex-home.0L1wy6/plugins/cache/readme-labs/readme-labs/0.2.0-rc.1/skills/readme-review/references/evidence-and-verification.md && sed -n '1,360p' /private/tmp/readme-labs-codex-home.0L1wy6/plugins/cache/readme-labs/readme-labs/0.2.0-rc.1/skills/readme-review/references/roles-and-anatomy.md","outcome":"succeeded"},{"command":"nl -ba README.md && rg --files -g '!node_modules' -g '!vendor' -g '!*.lock' | sort && find . -maxdepth 2 -type f -not -path './.git/*' | sort && git show --stat --oneline HEAD && git show --format=fuller --no-ext-diff HEAD -- README.md","outcome":"succeeded"},{"command":"nl -ba pyproject.toml && nl -ba src/pebble_count/__init__.py && nl -ba tests/test_pebble_count.py && git ls-files -s LICENSE COPYING NOTICE 2>/dev/null || true && git log --oneline --all -- README.md","outcome":"succeeded"}],"verification":["Reviewed the README, package metadata, CLI implementation, test fixture, repository file inventory, and the current README change history.","No repository files were modified."],"limitations":["The package was not installed or executed; this finding is supported by the declared console entry point and its implementation."]}